,tweet_id,timestamp,source,text,expanded_urls,rating_numerator,rating_denominator,Dog_Name,Dog_class,jpg_url,img_num,Dog_Type1,p1_conf,p1_dog,Dog_Type2,p2_conf,p2_dog,Dog_Type3,p3_conf,p3_dog,retweet_count,favorite_count
0,892420643555336193,2017-08-01 16:23:56,Twitter for iPhone,This is Phineas. He's a mystical boy. Only ever appears in the hole of a donut. 13/10 https://t.co/MgUWQ76dJU,https://twitter.com/dog_rates/status/892420643555336193/photo/1,13,10,phineas, ,https://pbs.twimg.com/media/DGKD1-bXoAAIAUK.jpg,1.0,orange,9.70%,False,bagel,8.59%,False,banana,7.61%,False,7468.0,35375.0
1,892177421306343426,2017-08-01 00:17:27,Twitter for iPhone,"This is Tilly. She's just checking pup on you. Hopes you're doing ok. If not, she's available for pats, snugs, boops, the whole bit. 13/10 https://t.co/0Xxu71qeIV",https://twitter.com/dog_rates/status/892177421306343426/photo/1,13,10,tilly, ,https://pbs.twimg.com/media/DGGmoV4XsAAUL6n.jpg,1.0,chihuahua,32.36%,True,pekinese,9.06%,True,papillon,6.90%,True,5545.0,30612.0
2,891815181378084864,2017-07-31 00:18:03,Twitter for iPhone,This is Archie. He is a rare Norwegian Pouncing Corgo. Lives in the tall grass. You never know when one may strike. 12/10 https://t.co/wUnZnhtVJB,https://twitter.com/dog_rates/status/891815181378084864/photo/1,12,10,archie, ,https://pbs.twimg.com/media/DGBdLU1WsAANxJ9.jpg,1.0,chihuahua,71.60%,True,malamute,7.83%,True,kelpie,3.14%,True,3671.0,23031.0
3,891689557279858688,2017-07-30 15:58:51,Twitter for iPhone,This is Darla. She commenced a snooze mid meal. 13/10 happens to the best of us https://t.co/tD36da7qLQ,https://twitter.com/dog_rates/status/891689557279858688/photo/1,13,10,darla, ,https://pbs.twimg.com/media/DF_q7IAWsAEuuN8.jpg,1.0,paper towel,17.03%,False,labrador retriever,16.81%,True,spatula,4.08%,False,7643.0,38666.0
4,891327558926688256,2017-07-29 16:00:24,Twitter for iPhone,"This is Franklin. He would like you to stop calling him ""cute."" He is a very fierce shark and should be respected as such. 12/10 #BarkWeek https://t.co/AtUZn91f7f","https://twitter.com/dog_rates/status/891327558926688256/photo/1,https://twitter.com/dog_rates/status/891327558926688256/photo/1",12,10,franklin, ,https://pbs.twimg.com/media/DF6hr6BUMAAzZgT.jpg,2.0,basset,55.57%,True,english springer,22.58%,True,german short-haired pointer,17.52%,True,8242.0,36946.0
5,891087950875897856,2017-07-29 00:08:17,Twitter for iPhone,Here we have a majestic great white breaching off South Africa's coast. Absolutely h*ckin breathtaking. 13/10 (IG: tucker_marlo) #BarkWeek https://t.co/kQ04fDDRmh,https://twitter.com/dog_rates/status/891087950875897856/photo/1,13,10,none, ,https://pbs.twimg.com/media/DF3HwyEWsAABqE6.jpg,1.0,chesapeake bay retriever,42.56%,True,irish terrier,11.63%,True,indian elephant,7.69%,False,2758.0,18625.0
6,890971913173991426,2017-07-28 16:27:12,Twitter for iPhone,"Meet Jax. He enjoys ice cream so much he gets nervous around it. 13/10 help Jax enjoy more things by clicking below

https://t.co/Zr4hWfAs1H https://t.co/tVJBRMnhxl","https://gofundme.com/ydvmve-surgery-for-jax,https://twitter.com/dog_rates/status/890971913173991426/photo/1",13,10,jax, ,https://pbs.twimg.com/media/DF1eOmZXUAALUcq.jpg,1.0,appenzeller,34.17%,True,border collie,19.93%,True,ice lolly,19.35%,False,1790.0,10818.0
7,890729181411237888,2017-07-28 00:22:40,Twitter for iPhone,When you watch your owner call another dog a good boy but then they turn back to you and say you're a great boy. 13/10 https://t.co/v0nONBcwxq,"https://twitter.com/dog_rates/status/890729181411237888/photo/1,https://twitter.com/dog_rates/status/890729181411237888/photo/1",13,10,none, ,https://pbs.twimg.com/media/DFyBahAVwAAhUTd.jpg,2.0,pomeranian,56.61%,True,eskimo dog,17.84%,True,pembroke,7.65%,True,16705.0,59603.0
8,890609185150312448,2017-07-27 16:25:51,Twitter for iPhone,This is Zoey. She doesn't want to be one of the scary sharks. Just wants to be a snuggly pettable boatpet. 13/10 #BarkWeek https://t.co/9TwLuAGH0b,https://twitter.com/dog_rates/status/890609185150312448/photo/1,13,10,zoey, ,https://pbs.twimg.com/media/DFwUU__XcAEpyXI.jpg,1.0,irish terrier,48.76%,True,irish setter,19.31%,True,chesapeake bay retriever,11.82%,True,3813.0,25626.0
9,890240255349198849,2017-07-26 15:59:51,Twitter for iPhone,This is Cassie. She is a college pup. Studying international doggo communication and stick theory. 14/10 so elegant much sophisticate https://t.co/t1bfwz5S2A,https://twitter.com/dog_rates/status/890240255349198849/photo/1,14,10,cassie,doggo,https://pbs.twimg.com/media/DFrEyVuW0AAO3t9.jpg,1.0,pembroke,51.13%,True,cardigan,45.10%,True,chihuahua,2.92%,True,6480.0,29249.0
10,890006608113172480,2017-07-26 00:31:25,Twitter for iPhone,This is Koda. He is a South Australian deckshark. Deceptively deadly. Frighteningly majestic. 13/10 would risk a petting #BarkWeek https://t.co/dVPW0B0Mme,"https://twitter.com/dog_rates/status/890006608113172480/photo/1,https://twitter.com/dog_rates/status/890006608113172480/photo/1",13,10,koda, ,https://pbs.twimg.com/media/DFnwSY4WAAAMliS.jpg,1.0,samoyed,95.80%,True,pomeranian,1.39%,True,chow,0.82%,True,6494.0,28195.0
11,889880896479866881,2017-07-25 16:11:53,Twitter for iPhone,This is Bruno. He is a service shark. Only gets out of the water to assist you. 13/10 terrifyingly good boy https://t.co/u1XPQMl29g,https://twitter.com/dog_rates/status/889880896479866881/photo/1,13,10,bruno, ,https://pbs.twimg.com/media/DFl99B1WsAITKsg.jpg,1.0,french bulldog,37.74%,True,labrador retriever,15.13%,True,muzzle,8.30%,False,4412.0,25655.0
12,889665388333682689,2017-07-25 01:55:32,Twitter for iPhone,Here's a puppo that seems to be on the fence about something haha no but seriously someone help her. 13/10 https://t.co/BxvuXk0UCm,https://twitter.com/dog_rates/status/889665388333682689/photo/1,13,10,none,puppo,https://pbs.twimg.com/media/DFi579UWsAAatzw.jpg,1.0,pembroke,96.63%,True,cardigan,2.74%,True,basenji,0.46%,True,8852.0,44051.0
13,889638837579907072,2017-07-25 00:10:02,Twitter for iPhone,This is Ted. He does his best. Sometimes that's not enough. But it's ok. 12/10 would assist https://t.co/f8dEDcrKSR,"https://twitter.com/dog_rates/status/889638837579907072/photo/1,https://twitter.com/dog_rates/status/889638837579907072/photo/1",12,10,ted, ,https://pbs.twimg.com/media/DFihzFfXsAYGDPR.jpg,1.0,french bulldog,99.17%,True,boxer,0.21%,True,staffordshire bullterrier,0.15%,True,3964.0,24781.0
14,889531135344209921,2017-07-24 17:02:04,Twitter for iPhone,This is Stuart. He's sporting his favorite fanny pack. Secretly filled with bones only. 13/10 puppared puppo #BarkWeek https://t.co/y70o6h3isq,https://twitter.com/dog_rates/status/889531135344209921/photo/1,13,10,stuart,puppo,https://pbs.twimg.com/media/DFg_2PVW0AEHN3p.jpg,1.0,golden retriever,95.34%,True,labrador retriever,1.38%,True,redbone,0.80%,True,1998.0,13941.0
15,889278841981685760,2017-07-24 00:19:32,Twitter for iPhone,This is Oliver. You're witnessing one of his many brutal attacks. Seems to be playing with his victim. 13/10 fr*ckin frightening #BarkWeek https://t.co/WpHvrQedPb,https://twitter.com/dog_rates/status/889278841981685760/video/1,13,10,oliver, ,https://pbs.twimg.com/ext_tw_video_thumb/889278779352338437/pu/img/VlbFB3v8H8VwzVNY.jpg,1.0,whippet,62.62%,True,borzoi,19.47%,True,saluki,2.74%,True,4713.0,23129.0
16,888917238123831296,2017-07-23 00:22:39,Twitter for iPhone,This is Jim. He found a fren. Taught him how to sit like the good boys. 12/10 for both https://t.co/chxruIOUJN,https://twitter.com/dog_rates/status/888917238123831296/photo/1,12,10,jim, ,https://pbs.twimg.com/media/DFYRgsOUQAARGhO.jpg,1.0,golden retriever,71.47%,True,tibetan mastiff,12.02%,True,labrador retriever,10.55%,True,3973.0,26744.0
17,888804989199671297,2017-07-22 16:56:37,Twitter for iPhone,This is Zeke. He has a new stick. Very proud of it. Would like you to throw it for him without taking it. 13/10 would do my best https://t.co/HTQ77yNQ5K,"https://twitter.com/dog_rates/status/888804989199671297/photo/1,https://twitter.com/dog_rates/status/888804989199671297/photo/1",13,10,zeke, ,https://pbs.twimg.com/media/DFWra-3VYAA2piG.jpg,1.0,golden retriever,46.98%,True,labrador retriever,18.42%,True,english setter,7.35%,True,3745.0,23477.0
18,888554962724278272,2017-07-22 00:23:06,Twitter for iPhone,This is Ralphus. He's powering up. Attempting maximum borkdrive. 13/10 inspirational af https://t.co/YnYAFCTTiK,"https://twitter.com/dog_rates/status/888554962724278272/photo/1,https://twitter.com/dog_rates/status/888554962724278272/photo/1,https://twitter.com/dog_rates/status/888554962724278272/photo/1,https://twitter.com/dog_rates/status/888554962724278272/photo/1",13,10,ralphus, ,https://pbs.twimg.com/media/DFTH_O-UQAACu20.jpg,3.0,siberian husky,70.04%,True,eskimo dog,16.65%,True,malamute,11.14%,True,3061.0,18098.0
19,888078434458587136,2017-07-20 16:49:33,Twitter for iPhone,This is Gerald. He was just told he didn't get the job he interviewed for. A h*ckin injustice. 12/10 didn't want the job anyway https://t.co/DK7iDPfuRX,"https://twitter.com/dog_rates/status/888078434458587136/photo/1,https://twitter.com/dog_rates/status/888078434458587136/photo/1",12,10,gerald, ,https://pbs.twimg.com/media/DFMWn56WsAAkA7B.jpg,1.0,french bulldog,99.50%,True,pug,0.09%,True,bull mastiff,0.09%,True,3073.0,20000.0
20,887705289381826560,2017-07-19 16:06:48,Twitter for iPhone,This is Jeffrey. He has a monopoly on the pool noodles. Currently running a 'boop for two' midweek sale. 13/10 h*ckin strategic https://t.co/PhrUk20Q64,https://twitter.com/dog_rates/status/887705289381826560/photo/1,13,10,jeffrey, ,https://pbs.twimg.com/media/DFHDQBbXgAEqY7t.jpg,1.0,basset,82.17%,True,redbone,8.76%,True,weimaraner,2.62%,True,4781.0,27801.0
21,887517139158093824,2017-07-19 03:39:09,Twitter for iPhone,I've yet to rate a Venezuelan Hover Wiener. This is such an honor. 14/10 paw-inspiring af (IG: roxy.thedoxy) https://t.co/20VrLAA8ba,https://twitter.com/dog_rates/status/887517139158093824/video/1,14,10,such, ,https://pbs.twimg.com/ext_tw_video_thumb/887517108413886465/pu/img/WanJKwssZj4VJvL9.jpg,1.0,limousine,13.04%,False,tow truck,2.92%,False,shopping cart,2.63%,False,10427.0,42593.0
22,887473957103951883,2017-07-19 00:47:34,Twitter for iPhone,This is Canela. She attempted some fancy porch pics. They were unsuccessful. 13/10 someone help her https://t.co/cLyzpcUcMX,"https://twitter.com/dog_rates/status/887473957103951883/photo/1,https://twitter.com/dog_rates/status/887473957103951883/photo/1",13,10,canela, ,https://pbs.twimg.com/media/DFDw2tyUQAAAFke.jpg,2.0,pembroke,80.92%,True,rhodesian ridgeback,5.50%,True,beagle,3.89%,True,15917.0,63025.0
23,887343217045368832,2017-07-18 16:08:03,Twitter for iPhone,You may not have known you needed to see this today. 13/10 please enjoy (IG: emmylouroo) https://t.co/WZqNqygEyV,https://twitter.com/dog_rates/status/887343217045368832/video/1,13,10,none, ,https://pbs.twimg.com/ext_tw_video_thumb/887343120832229379/pu/img/6HSuFrW1lzI_9Mht.jpg,1.0,mexican hairless,33.07%,True,sea lion,27.56%,False,weimaraner,13.42%,True,9324.0,30923.0
24,887101392804085760,2017-07-18 00:07:08,Twitter for iPhone,This... is a Jubilant Antarctic House Bear. We only rate dogs. Please only send dogs. Thank you... 12/10 would suffocate in floof https://t.co/4Ad1jzJSdp,https://twitter.com/dog_rates/status/887101392804085760/photo/1,12,10,none, ,https://pbs.twimg.com/media/DE-eAq6UwAA-jaE.jpg,1.0,samoyed,73.39%,True,eskimo dog,3.50%,True,staffordshire bullterrier,2.97%,True,5277.0,28134.0
25,886983233522544640,2017-07-17 16:17:36,Twitter for iPhone,This is Maya. She's very shy. Rarely leaves her cup. 13/10 would find her an environment to thrive in https://t.co/I6oNy0CgiT,"https://twitter.com/dog_rates/status/886983233522544640/photo/1,https://twitter.com/dog_rates/status/886983233522544640/photo/1",13,10,maya, ,https://pbs.twimg.com/media/DE8yicJW0AAAvBJ.jpg,2.0,chihuahua,79.35%,True,toy terrier,14.35%,True,can opener,3.23%,False,6771.0,31957.0
26,886736880519319552,2017-07-16 23:58:41,Twitter for iPhone,"This is Mingus. He's a wonderful father to his smol pup. Confirmed 13/10, but he needs your help

https://t.co/bVi0Yr4Cff https://t.co/ISvKOSkd5b","https://www.gofundme.com/mingusneedsus,https://twitter.com/dog_rates/status/886736880519319552/photo/1,https://twitter.com/dog_rates/status/886736880519319552/photo/1",13,10,mingus, ,https://pbs.twimg.com/media/DE5Se8FXcAAJFx4.jpg,1.0,kuvasz,30.97%,True,great pyrenees,18.61%,True,dandie dinmont,8.63%,True,2821.0,10976.0
27,886680336477933568,2017-07-16 20:14:00,Twitter for iPhone,This is Derek. He's late for a dog meeting. 13/10 pet...al to the metal https://t.co/BCoWue0abA,https://twitter.com/dog_rates/status/886680336477933568/photo/1,13,10,derek, ,https://pbs.twimg.com/media/DE4fEDzWAAAyHMM.jpg,1.0,convertible,73.90%,False,sports car,14.00%,False,car wheel,4.42%,False,3962.0,20662.0
28,886366144734445568,2017-07-15 23:25:31,Twitter for iPhone,This is Roscoe. Another pupper fallen victim to spontaneous tongue ejections. Get the BlepiPen immediate. 12/10 deep breaths Roscoe https://t.co/RGE08MIJox,"https://twitter.com/dog_rates/status/886366144734445568/photo/1,https://twitter.com/dog_rates/status/886366144734445568/photo/1",12,10,roscoe,pupper,https://pbs.twimg.com/media/DE0BTnQUwAApKEH.jpg,1.0,french bulldog,99.92%,True,chihuahua,0.04%,True,boston bull,0.01%,True,2804.0,19396.0
30,886258384151887873,2017-07-15 16:17:19,Twitter for iPhone,This is Waffles. His doggles are pupside down. Unsure how to fix. 13/10 someone assist Waffles https://t.co/xZDA9Qsq1O,https://twitter.com/dog_rates/status/886258384151887873/photo/1,13,10,waffles, ,https://pbs.twimg.com/media/DEyfTG4UMAE4aE9.jpg,1.0,pug,94.36%,True,shower cap,2.53%,False,siamese cat,0.28%,False,5601.0,25680.0
31,885984800019947520,2017-07-14 22:10:11,Twitter for iPhone,Viewer discretion advised. This is Jimbo. He will rip ur finger right h*ckin off. Other dog clearly an accessory. 12/10 pls pet with caution https://t.co/BuveP0uMF1,https://twitter.com/dog_rates/status/885984800019947520/photo/1,12,10,jimbo, ,https://pbs.twimg.com/media/DEumeWWV0AA-Z61.jpg,1.0,blenheim spaniel,97.25%,True,shih-tzu,0.66%,True,bernese mountain dog,0.62%,True,5949.0,29921.0
32,885528943205470208,2017-07-13 15:58:47,Twitter for iPhone,This is Maisey. She fell asleep mid-excavation. Happens to the best of us. 13/10 would pat noggin approvingly https://t.co/tp1kQ8i9JF,https://twitter.com/dog_rates/status/885528943205470208/photo/1,13,10,maisey, ,https://pbs.twimg.com/media/DEoH3yvXgAAzQtS.jpg,1.0,pug,36.93%,True,labrador retriever,26.58%,True,kuvasz,13.47%,True,5662.0,33012.0
34,885167619883638784,2017-07-12 16:03:00,Twitter for iPhone,Here we have a corgi undercover as a malamute. Pawbably doing important investigative work. Zero control over tongue happenings. 13/10 https://t.co/44ItaMubBf,"https://twitter.com/dog_rates/status/885167619883638784/photo/1,https://twitter.com/dog_rates/status/885167619883638784/photo/1,https://twitter.com/dog_rates/status/885167619883638784/photo/1,https://twitter.com/dog_rates/status/885167619883638784/photo/1",13,10,none, ,https://pbs.twimg.com/media/DEi_N9qXYAAgEEw.jpg,4.0,malamute,81.25%,True,siberian husky,7.17%,True,eskimo dog,5.58%,True,3867.0,20074.0
35,884925521741709313,2017-07-12 00:01:00,Twitter for iPhone,"This is Earl. He found a hat. Nervous about what you think of it. 12/10 it's delightful, Earl https://t.co/MYJvdlNRVa",https://twitter.com/dog_rates/status/884925521741709313/photo/1,12,10,earl, ,https://pbs.twimg.com/media/DEfjEaNXkAAtPlj.jpg,1.0,italian greyhound,25.99%,True,american staffordshire terrier,19.85%,True,staffordshire bullterrier,12.77%,True,15973.0,70643.0
36,884876753390489601,2017-07-11 20:47:12,Twitter for iPhone,This is Lola. It's her first time outside. Must test the earth and taste the atmosphere. 13/10 you're doing great Lola https://t.co/74TKAUsLkO,"https://twitter.com/dog_rates/status/884876753390489601/photo/1,https://twitter.com/dog_rates/status/884876753390489601/photo/1,https://twitter.com/dog_rates/status/884876753390489601/photo/1,https://twitter.com/dog_rates/status/884876753390489601/photo/1",13,10,lola, ,https://pbs.twimg.com/media/DEe2tZXXkAAwyX3.jpg,1.0,chow,82.21%,True,norwich terrier,10.61%,True,norfolk terrier,3.73%,True,4944.0,25526.0
37,884562892145688576,2017-07-11 00:00:02,Twitter for iPhone,This is Kevin. He's just so happy. 13/10 what is your secret Kevin https://t.co/1r4MFCbCX5,https://twitter.com/dog_rates/status/884562892145688576/photo/1,13,10,kevin, ,https://pbs.twimg.com/media/DEaZQkfXUAEC7qB.jpg,1.0,pug,54.64%,True,french bulldog,40.43%,True,brabancon griffon,4.40%,True,4159.0,22323.0
38,884441805382717440,2017-07-10 15:58:53,Twitter for iPhone,"I present to you, Pup in Hat. Pup in Hat is great for all occasions. Extremely versatile. Compact as h*ck. 14/10 (IG: itselizabethgales) https://t.co/vvBOcC2VdC",https://twitter.com/dog_rates/status/884441805382717440/photo/1,14,10,none, ,https://pbs.twimg.com/media/DEYrIZwWsAA2Wo5.jpg,1.0,pembroke,99.32%,True,cardigan,0.32%,True,chihuahua,0.21%,True,5047.0,24892.0
40,884162670584377345,2017-07-09 21:29:42,Twitter for iPhone,Meet Yogi. He doesn't have any important dog meetings today he just enjoys looking his best at all times. 12/10 for dangerously dapper doggo https://t.co/YSI00BzTBZ,https://twitter.com/dog_rates/status/884162670584377345/photo/1,12,10,yogi,doggo,https://pbs.twimg.com/media/DEUtQbzW0AUTv_o.jpg,1.0,german shepherd,70.70%,True,malinois,19.94%,True,norwegian elkhound,4.91%,True,2651.0,18747.0
41,883838122936631299,2017-07-09 00:00:04,Twitter for iPhone,This is Noah. He can't believe someone made this mess. Got the vacuum out for you though. Offered to help clean pup. 12/10 super good boy https://t.co/V85xujjDDY,https://twitter.com/dog_rates/status/883838122936631299/photo/1,12,10,noah, ,https://pbs.twimg.com/media/DEQGFgAXUAAEvfi.jpg,1.0,doberman,61.09%,True,miniature pinscher,29.96%,True,kelpie,6.30%,True,3027.0,20066.0
42,883482846933004288,2017-07-08 00:28:19,Twitter for iPhone,"This is Bella. She hopes her smile made you smile. If not, she is also offering you her favorite monkey. 13.5/10 https://t.co/qjrljjt948","https://twitter.com/dog_rates/status/883482846933004288/photo/1,https://twitter.com/dog_rates/status/883482846933004288/photo/1",5,10,bella, ,https://pbs.twimg.com/media/DELC9dZXUAADqUk.jpg,1.0,golden retriever,94.31%,True,labrador retriever,3.24%,True,kuvasz,0.55%,True,8744.0,42072.0
43,883360690899218434,2017-07-07 16:22:55,Twitter for iPhone,Meet Grizzwald. He may be the floofiest floofer I ever did see. Lost eyes saving a schoolbus from a volcano erpuption. 13/10 heroic as h*ck https://t.co/rf661IFEYP,https://twitter.com/dog_rates/status/883360690899218434/photo/1,13,10,grizzwald,floofer,https://pbs.twimg.com/media/DEJT3FeXoAAtwUy.jpg,1.0,chow,98.80%,True,tibetan mastiff,0.71%,True,newfoundland,0.21%,True,3265.0,20843.0
44,883117836046086144,2017-07-07 00:17:54,Twitter for iPhone,"Please only send dogs. We don't rate mechanics, no matter how h*ckin good. Thank you... 13/10 would sneak a pat https://t.co/Se5fZ9wp5E","https://twitter.com/dog_rates/status/883117836046086144/photo/1,https://twitter.com/dog_rates/status/883117836046086144/photo/1",13,10,none, ,https://pbs.twimg.com/media/DEF2-_hXoAAs62q.jpg,2.0,golden retriever,94.96%,True,labrador retriever,4.59%,True,kuvasz,0.25%,True,5876.0,34026.0
45,882992080364220416,2017-07-06 15:58:11,Twitter for iPhone,This is Rusty. He wasn't ready for the first pic. Clearly puppared for the second. 13/10 confirmed great boy https://t.co/tyER0KpdXj,"https://twitter.com/dog_rates/status/882992080364220416/photo/1,https://twitter.com/dog_rates/status/882992080364220416/photo/1",13,10,rusty, ,https://pbs.twimg.com/media/DEEEnIqXYAAiJh_.jpg,1.0,eskimo dog,46.68%,True,siberian husky,40.60%,True,dingo,7.34%,False,3435.0,21930.0
46,882762694511734784,2017-07-06 00:46:41,Twitter for iPhone,This is Gus. He's quite the cheeky pupper. Already perfected the disinterested wink. 12/10 would let steal my girl https://t.co/D43I96SlVu,https://twitter.com/dog_rates/status/882762694511734784/photo/1,12,10,gus,pupper,https://pbs.twimg.com/media/DEAz_HHXsAA-p_z.jpg,1.0,labrador retriever,85.00%,True,chesapeake bay retriever,7.43%,True,flat-coated retriever,1.56%,True,4323.0,25940.0
47,882627270321602560,2017-07-05 15:48:34,Twitter for iPhone,This is Stanley. He has his first swim lesson today. Doggle straps adjusted. Ready to go. 13/10 Phelps is nervous (IG: stanleythe_corgi) https://t.co/Nx52PGwH94,https://twitter.com/dog_rates/status/882627270321602560/photo/1,13,10,stanley, ,https://pbs.twimg.com/media/DD-40X3WAAAJPU5.jpg,1.0,pembroke,54.30%,True,chihuahua,25.20%,True,cardigan,10.77%,True,5375.0,25717.0
48,882268110199369728,2017-07-04 16:01:23,Twitter for iPhone,This is Alfy. You're witnessing his first watermelon experience. I think it was a success. 13/10 happy 4th Alfy ðŸ‡ºðŸ‡¸ https://t.co/fYP5RlutfA,"https://twitter.com/dog_rates/status/882268110199369728/photo/1,https://twitter.com/dog_rates/status/882268110199369728/photo/1,https://twitter.com/dog_rates/status/882268110199369728/photo/1",13,10,alfy, ,https://pbs.twimg.com/media/DD5yKdPW0AArzX8.jpg,1.0,golden retriever,76.22%,True,labrador retriever,9.90%,True,cocker spaniel,1.72%,True,10274.0,41138.0
49,882045870035918850,2017-07-04 01:18:17,Twitter for iPhone,"This is Koko. Her owner, inspired by Barney, recently built a cart for her to use during walks if she got tired. 13/10 rest easy Koko https://t.co/zeDpnsKX7w","https://twitter.com/dog_rates/status/882045870035918850/photo/1,https://twitter.com/dog_rates/status/882045870035918850/photo/1,https://twitter.com/dog_rates/status/882045870035918850/photo/1,https://twitter.com/dog_rates/status/882045870035918850/photo/1",13,10,koko, ,https://pbs.twimg.com/media/DD2oCl2WAAEI_4a.jpg,1.0,web site,94.96%,False,dhole,1.73%,False,golden retriever,0.69%,True,4312.0,26919.0
50,881906580714921986,2017-07-03 16:04:48,Twitter for iPhone,This is Rey. He's a Benebop Cumberfloof. 12/10 dangerously pettable https://t.co/503CgWbhxQ,https://twitter.com/dog_rates/status/881906580714921986/photo/1,12,10,rey, ,https://pbs.twimg.com/media/DD0pWm9XcAAeSBL.jpg,1.0,weimaraner,29.15%,True,chesapeake bay retriever,27.90%,True,koala,12.70%,False,3016.0,22386.0
51,881666595344535552,2017-07-03 00:11:11,Twitter for iPhone,This is Gary. He couldn't miss this puppertunity for a selfie. Flawless focusing skills. 13/10 would boop intensely https://t.co/7CSWCl8I6s,https://twitter.com/dog_rates/status/881666595344535552/photo/1,13,10,gary, ,https://pbs.twimg.com/media/DDxPFwbWAAEbVVR.jpg,1.0,saluki,52.90%,True,afghan hound,25.00%,True,golden retriever,16.07%,True,9453.0,46530.0
53,881536004380872706,2017-07-02 15:32:16,Twitter for iPhone,"Here is a pupper approaching maximum borkdrive. Zooming at never before seen speeds. 14/10 paw-inspiring af 
(IG: puffie_the_chow) https://t.co/ghXBIIeQZF",https://twitter.com/dog_rates/status/881536004380872706/video/1,14,10,a,pupper,https://pbs.twimg.com/ext_tw_video_thumb/881535971568889856/pu/img/9bawiZ--8FKywTkz.jpg,1.0,samoyed,28.15%,True,angora,27.21%,False,persian cat,11.49%,False,14186.0,45431.0
54,881268444196462592,2017-07-01 21:49:04,Twitter for iPhone,Meet Elliot. He's a Canadian Forrest Pup. Unusual number of antlers for a dog. Sneaky tongue slip to celebrate #Canada150. 12/10 would pet https://t.co/cgwJwowTMC,https://twitter.com/dog_rates/status/881268444196462592/photo/1,12,10,elliot, ,https://pbs.twimg.com/media/DDrk-f9WAAI-WQv.jpg,1.0,tusker,47.33%,False,indian elephant,24.56%,False,ibex,5.57%,False,4696.0,21398.0
55,880935762899988482,2017-06-30 23:47:07,Twitter for iPhone,This is Louis. He's crossing. It's a big deal. 13/10 h*ckin breathtaking https://t.co/D0wb1GlKAt,https://twitter.com/dog_rates/status/880935762899988482/photo/1,13,10,louis, ,https://pbs.twimg.com/media/DDm2Z5aXUAEDS2u.jpg,1.0,street sign,25.18%,False,umbrella,11.51%,False,traffic light,6.95%,False,2482.0,15721.0
56,880872448815771648,2017-06-30 19:35:32,Twitter for iPhone,Ugh not again. We only rate dogs. Please don't send in well-dressed  floppy-tongued street penguins. Dogs only please. Thank you... 12/10 https://t.co/WiAMbTkDPf,https://twitter.com/dog_rates/status/880872448815771648/photo/1,12,10,none, ,https://pbs.twimg.com/media/DDl8zzJW0AAisCJ.jpg,1.0,pembroke,79.14%,True,norwich terrier,6.14%,True,chihuahua,3.37%,True,3392.0,19560.0
57,880465832366813184,2017-06-29 16:39:47,Twitter for iPhone,This is Bella. She had her first beach experience this morning. Complete success. 12/10 would perform a sandy boop https://t.co/4VsFysDmiw,"https://twitter.com/dog_rates/status/880465832366813184/photo/1,https://twitter.com/dog_rates/status/880465832366813184/photo/1,https://twitter.com/dog_rates/status/880465832366813184/photo/1,https://twitter.com/dog_rates/status/880465832366813184/photo/1",12,10,bella, ,https://pbs.twimg.com/media/DDgK-J4XUAIEV9W.jpg,1.0,golden retriever,91.33%,True,labrador retriever,2.63%,True,cocker spaniel,0.94%,True,5511.0,26141.0
58,880221127280381952,2017-06-29 00:27:25,Twitter for iPhone,Meet Jesse. He's a Fetty Woof. His tongue ejects without warning. A true bleptomaniac. 12/10 would snug well https://t.co/fUod0tVmvK,"https://twitter.com/dog_rates/status/880221127280381952/photo/1,https://twitter.com/dog_rates/status/880221127280381952/photo/1",12,10,jesse, ,https://pbs.twimg.com/media/DDcscbXU0AIfDzs.jpg,1.0,chihuahua,23.85%,True,meerkat,10.43%,False,clumber,5.26%,True,3683.0,24741.0
